[
  {
    "id": "sakura",
    "name": "Cherry blossom (hanami)",
    "category": "seasonal",
    "lon": 135.0,
    "lat": 35.0,
    "when": "late January in Okinawa, late March in the south of Japan and Korea, early May in Hokkaido",
    "approx": true,
    "summary": "The blossom front moves north: peak in each area, plus or minus 7 days.",
    "details": "Hanami (blossom viewing) peaks first in the far south and moves north over about three months. Dates are rough typical peaks (mostly from general knowledge, not a forecast) and shift by a week or two each year; the area table is meant to be corrected. China is a very rough starter.",
    "crowd": "Popular parks are crowded at the peak.",
    "price": "Hotels rise during the peak week.",
    "fronts": [
      {
        "country": "JP",
        "spread": 7,
        "anchors": [
          [
            26.2,
            "01-25"
          ],
          [
            31.6,
            "03-24"
          ],
          [
            33.6,
            "03-25"
          ],
          [
            35.7,
            "03-29"
          ],
          [
            38.3,
            "04-08"
          ],
          [
            40.8,
            "04-19"
          ],
          [
            43.1,
            "04-29"
          ]
        ]
      },
      {
        "country": "KR",
        "spread": 7,
        "anchors": [
          [
            33.3,
            "03-24"
          ],
          [
            35.2,
            "03-30"
          ],
          [
            37.6,
            "04-08"
          ],
          [
            38.3,
            "04-13"
          ]
        ]
      },
      {
        "country": "CN",
        "spread": 7,
        "minLat": 24,
        "anchors": [
          [
            25.0,
            "03-01"
          ],
          [
            30.6,
            "03-20"
          ],
          [
            34.3,
            "04-02"
          ],
          [
            39.9,
            "04-08"
          ]
        ]
      }
    ],
    "highlights": [
      {
        "name": "Ueno Park, Tokyo",
        "lon": 139.77,
        "lat": 35.715,
        "on": "03-29",
        "spread": 7
      },
      {
        "name": "Philosopher's Path, Kyoto",
        "lon": 135.795,
        "lat": 35.027,
        "on": "03-30",
        "spread": 7
      },
      {
        "name": "Hirosaki Castle",
        "lon": 140.46,
        "lat": 40.607,
        "on": "04-25",
        "spread": 7
      },
      {
        "name": "Jinhae, Korea",
        "lon": 128.66,
        "lat": 35.14,
        "on": "03-31",
        "spread": 7
      },
      {
        "name": "Wuhan University",
        "lon": 114.36,
        "lat": 30.54,
        "on": "03-22",
        "spread": 7
      }
    ],
    "links": {
      "wiki": "https://en.wikipedia.org/wiki/Hanami"
    }
  },
  {
    "id": "momiji",
    "name": "Autumn leaves (momiji)",
    "category": "seasonal",
    "lon": 135.0,
    "lat": 35.0,
    "when": "mid-October in the far north, late November to early December in the south",
    "approx": true,
    "summary": "The colour front moves south: peak in each area, plus or minus 7 days.",
    "details": "Autumn colour starts in the north and the mountains and moves south. Dates are rough typical peaks (mostly from general knowledge, not a forecast) and shift by a week or two each year; the area table is meant to be corrected. Altitude is not modelled, so mountain areas peak earlier than shown. China is a very rough starter.",
    "crowd": "Among the busiest times of the year at famous spots.",
    "price": "Hotel prices peak in Kyoto.",
    "fronts": [
      {
        "country": "JP",
        "spread": 7,
        "minLat": 30,
        "anchors": [
          [
            31.6,
            "12-05"
          ],
          [
            33.6,
            "12-01"
          ],
          [
            35.7,
            "11-28"
          ],
          [
            38.3,
            "11-10"
          ],
          [
            40.8,
            "10-30"
          ],
          [
            43.1,
            "10-20"
          ]
        ]
      },
      {
        "country": "KR",
        "spread": 7,
        "anchors": [
          [
            33.3,
            "11-05"
          ],
          [
            35.2,
            "11-12"
          ],
          [
            37.6,
            "11-01"
          ],
          [
            38.3,
            "10-18"
          ]
        ]
      },
      {
        "country": "CN",
        "spread": 7,
        "minLat": 28,
        "anchors": [
          [
            30.0,
            "11-25"
          ],
          [
            34.3,
            "11-10"
          ],
          [
            40.0,
            "10-30"
          ],
          [
            47.0,
            "10-05"
          ]
        ]
      }
    ],
    "highlights": [
      {
        "name": "Arashiyama, Kyoto",
        "lon": 135.67,
        "lat": 35.01,
        "on": "11-25",
        "spread": 7
      },
      {
        "name": "Nikko",
        "lon": 139.6,
        "lat": 36.75,
        "on": "10-25",
        "spread": 7
      },
      {
        "name": "Seoraksan, Korea",
        "lon": 128.47,
        "lat": 38.12,
        "on": "10-18",
        "spread": 7
      },
      {
        "name": "Naejangsan, Korea",
        "lon": 126.89,
        "lat": 35.49,
        "on": "11-05",
        "spread": 7
      },
      {
        "name": "Xiangshan, Beijing",
        "lon": 116.19,
        "lat": 39.99,
        "on": "10-28",
        "spread": 7
      }
    ],
    "links": {
      "wiki": "https://en.wikipedia.org/wiki/Momijigari"
    }
  }
]
