[
  {
    "id": "round-festival",
    "name": "ROUND Festival (ASEAN-Korea Music Festival)",
    "category": "concert",
    "lon": 126.7,
    "lat": 37.46,
    "peaks": [
      {
        "on": "11-07",
        "spread": 1
      }
    ],
    "when": "7-8 November 2026, Incheon",
    "summary": "Korea and ASEAN artists in a two-day festival.",
    "links": {
      "wiki": "https://en.wikipedia.org/wiki/Round_Festival"
    }
  },
  {
    "id": "marunouchi-soundscape",
    "name": "Marunouchi Soundscape",
    "category": "concert",
    "lon": 139.765,
    "lat": 35.68,
    "peaks": [
      {
        "on": "11-13",
        "spread": 2
      }
    ],
    "when": "12-15 November 2026, Tokyo",
    "approx": true,
    "summary": "Music festival in Tokyo's Marunouchi district."
  },
  {
    "id": "mutek-jp",
    "name": "MUTEK JP",
    "category": "concert",
    "lon": 139.7,
    "lat": 35.66,
    "peaks": [
      {
        "on": "11-21",
        "spread": 2
      }
    ],
    "when": "20-23 November 2026, Tokyo",
    "approx": true,
    "summary": "Electronic music and digital art festival."
  },
  {
    "id": "wonderfruit",
    "name": "Wonderfruit",
    "category": "concert",
    "lon": 100.88,
    "lat": 12.93,
    "peaks": [
      {
        "on": "12-05",
        "spread": 2
      }
    ],
    "when": "3-7 December 2026, near Pattaya",
    "approx": true,
    "summary": "Music, arts and lifestyle festival in Pattaya.",
    "details": "Sources disagree on the exact days; check the official site.",
    "links": {
      "wiki": "https://en.wikipedia.org/wiki/Wonderfruit",
      "official": "https://wonderfruit.co/"
    }
  },
  {
    "id": "clockenflap",
    "name": "Clockenflap",
    "category": "concert",
    "lon": 114.17,
    "lat": 22.285,
    "peaks": [
      {
        "on": "12-05",
        "spread": 1
      }
    ],
    "when": "4-6 December 2026, Hong Kong",
    "summary": "Open-air music and arts festival on the Central Harbourfront.",
    "links": {
      "wiki": "https://en.wikipedia.org/wiki/Clockenflap",
      "official": "https://www.clockenflap.com/"
    }
  },
  {
    "id": "tomorrowland-thailand",
    "name": "Tomorrowland Thailand",
    "category": "concert",
    "lon": 101.0,
    "lat": 13.36,
    "peaks": [
      {
        "on": "12-12",
        "spread": 1
      }
    ],
    "when": "11-13 December 2026, Chonburi",
    "approx": true,
    "summary": "Electronic dance music festival.",
    "links": {
      "wiki": "https://en.wikipedia.org/wiki/Tomorrowland_(festival)",
      "official": "https://www.tomorrowland.com/"
    }
  },
  {
    "id": "fuji-rock",
    "name": "Fuji Rock Festival",
    "category": "concert",
    "lon": 138.78,
    "lat": 36.84,
    "peaks": [
      {
        "on": "07-24",
        "spread": 1
      }
    ],
    "when": "about 23-25 July 2027 (not yet confirmed), Naeba, Niigata",
    "approx": true,
    "summary": "Japan's biggest outdoor music festival.",
    "details": "2026 ran 24-26 July. Listings for 2027 are estimates until the organisers publish dates.",
    "crowd": "Very busy; accommodation in the valley sells out.",
    "price": "Accommodation near Naeba rises sharply.",
    "links": {
      "wiki": "https://en.wikipedia.org/wiki/Fuji_Rock_Festival",
      "official": "https://en.fujirockfestival.com/"
    }
  },
  {
    "id": "summer-sonic-tokyo",
    "name": "Summer Sonic (Tokyo)",
    "category": "concert",
    "lon": 140.03,
    "lat": 35.65,
    "peaks": [
      {
        "on": "08-15",
        "spread": 1
      }
    ],
    "when": "mid August (2027 dates not announced; 2026 was 14-16 August)",
    "approx": true,
    "summary": "Large urban rock and pop festival at Zozo Marine Stadium and Makuhari Messe.",
    "links": {
      "wiki": "https://en.wikipedia.org/wiki/Summer_Sonic_Festival",
      "official": "https://www.summersonic.com/"
    }
  },
  {
    "id": "summer-sonic-osaka",
    "name": "Summer Sonic (Osaka)",
    "category": "concert",
    "lon": 135.53,
    "lat": 34.8,
    "peaks": [
      {
        "on": "08-15",
        "spread": 1
      }
    ],
    "when": "mid August (2027 dates not announced; 2026 was 14-16 August)",
    "approx": true,
    "summary": "Osaka leg of Summer Sonic at Expo 70 Commemorative Park.",
    "links": {
      "wiki": "https://en.wikipedia.org/wiki/Summer_Sonic_Festival",
      "official": "https://www.summersonic.com/"
    }
  },
  {
    "id": "ultra-japan",
    "name": "Ultra Japan",
    "category": "concert",
    "lon": 139.78,
    "lat": 35.62,
    "peaks": [
      {
        "on": "09-19",
        "spread": 1
      }
    ],
    "when": "mid to late September (2027 dates not announced; 2026 was 19-20 September)",
    "approx": true,
    "summary": "Electronic dance music festival in Tokyo Odaiba.",
    "links": {
      "official": "https://ultrajapan.com/"
    }
  },
  {
    "id": "world-dj-festival",
    "name": "World DJ Festival",
    "category": "concert",
    "lon": 127.02,
    "lat": 37.43,
    "peaks": [
      {
        "on": "06-13",
        "spread": 1
      }
    ],
    "when": "mid June (2027 dates not announced; 2026 was 13-14 June)",
    "approx": true,
    "summary": "Two-night DJ festival at Seoul Land."
  },
  {
    "id": "pentaport",
    "name": "Pentaport Rock Festival",
    "category": "concert",
    "lon": 126.7,
    "lat": 37.46,
    "peaks": [
      {
        "on": "08-01",
        "spread": 1
      }
    ],
    "when": "about 31 July to 2 August (year not confirmed)",
    "approx": true,
    "summary": "Korean rock festival in Incheon."
  },
  {
    "id": "strawberry-music-festival",
    "name": "Strawberry Music Festival (China)",
    "category": "concert",
    "tier": 2,
    "icon": "strawberry",
    "lon": 113.869,
    "lat": 22.932,
    "peaks": [
      {
        "on": "05-03",
        "spread": 2
      },
      {
        "on": "10-04",
        "spread": 1
      }
    ],
    "when": "no 2027 dates announced; recent editions ran around Labor Day (2-4 May 2025 in Beijing Yanqing, 2-4 May 2026 in Dongguan) and National Day (4-5 October 2024, Dongguan), with other cities on other weekends",
    "approx": true,
    "summary": "Modern Sky's touring indie music festival, one of the oldest in China, held in a different city each weekend of the season.",
    "details": "Founded in 2009 by the label Modern Sky. Each edition is held in one or more cities with its own dates and lineup. The 2026 edition (theme \"On! Holiday!\") announced Beijing, Changsha, Chengdu, Dongguan, Harbin, Hohhot, Suzhou, Urumqi and Wuhan; Wuhan ran 4-5 April 2026 and the Foshan stop was cancelled in March. The dates shown on the map are the typical Labor Day and National Day slots, not announced dates. Check Modern Sky and the ticketing pages for 2027.",
    "price": "Wuhan 2026 single-day tickets ran from 268 to 468 RMB (early bird to full price).",
    "aliases": [
      "草莓音乐节",
      "caomei",
      "caomei yinyuejie",
      "modern sky",
      "摩登天空",
      "strawberry festival",
      "strawberry"
    ],
    "links": {
      "wiki": "https://en.wikipedia.org/wiki/Modern_Sky",
      "official": "https://www.modernsky.com/home/"
    }
  }
]
